[
  {
    "schemaVersion": 1,
    "caseId": "geometry/foundations/control-track/default/lg/dark/rest-1440",
    "storyId": "foundations-measurement-targets--target-lineup",
    "ownerBrief": "03",
    "executionMode": "automated",
    "selectors": {
      "root": {
        "attribute": "data-geometry-id",
        "value": "target-control-track-lg",
        "kind": "element"
      }
    },
    "scenario": {
      "engine": "chromium",
      "viewport": {
        "width": 1440,
        "height": 900
      },
      "colorScheme": "dark",
      "direction": "ltr",
      "pointer": "fine",
      "forcedColors": "none",
      "reducedMotion": "no-preference",
      "initialState": "rest",
      "actions": [],
      "assertions": [
        {
          "op": "box",
          "target": "root",
          "metric": "height",
          "expected": 40,
          "tolerance": 0.5,
          "unit": "css-px"
        },
        {
          "op": "style",
          "target": "root",
          "property": "height",
          "expected": "40px"
        },
        {
          "op": "attribute",
          "target": "root",
          "name": "data-state",
          "expected": null
        },
        {
          "op": "screenshot",
          "target": "root"
        }
      ]
    },
    "transfer": null
  },
  {
    "schemaVersion": 1,
    "caseId": "geometry/foundations/control-track/default/lg/light/rest-1440",
    "storyId": "foundations-measurement-targets--target-lineup",
    "ownerBrief": "03",
    "executionMode": "automated",
    "selectors": {
      "root": {
        "attribute": "data-geometry-id",
        "value": "target-control-track-lg",
        "kind": "element"
      }
    },
    "scenario": {
      "engine": "chromium",
      "viewport": {
        "width": 1440,
        "height": 900
      },
      "colorScheme": "light",
      "direction": "ltr",
      "pointer": "fine",
      "forcedColors": "none",
      "reducedMotion": "no-preference",
      "initialState": "rest",
      "actions": [],
      "assertions": [
        {
          "op": "box",
          "target": "root",
          "metric": "height",
          "expected": 40,
          "tolerance": 0.5,
          "unit": "css-px"
        },
        {
          "op": "style",
          "target": "root",
          "property": "height",
          "expected": "40px"
        },
        {
          "op": "attribute",
          "target": "root",
          "name": "data-state",
          "expected": null
        },
        {
          "op": "screenshot",
          "target": "root"
        }
      ]
    },
    "transfer": null
  },
  {
    "schemaVersion": 1,
    "caseId": "geometry/foundations/control-track/default/md/dark/rest-1440",
    "storyId": "foundations-measurement-targets--target-lineup",
    "ownerBrief": "03",
    "executionMode": "automated",
    "selectors": {
      "root": {
        "attribute": "data-geometry-id",
        "value": "target-control-track-md",
        "kind": "element"
      }
    },
    "scenario": {
      "engine": "chromium",
      "viewport": {
        "width": 1440,
        "height": 900
      },
      "colorScheme": "dark",
      "direction": "ltr",
      "pointer": "fine",
      "forcedColors": "none",
      "reducedMotion": "no-preference",
      "initialState": "rest",
      "actions": [],
      "assertions": [
        {
          "op": "box",
          "target": "root",
          "metric": "height",
          "expected": 32,
          "tolerance": 0.5,
          "unit": "css-px"
        },
        {
          "op": "style",
          "target": "root",
          "property": "height",
          "expected": "32px"
        },
        {
          "op": "attribute",
          "target": "root",
          "name": "data-state",
          "expected": null
        },
        {
          "op": "screenshot",
          "target": "root"
        }
      ]
    },
    "transfer": null
  },
  {
    "schemaVersion": 1,
    "caseId": "geometry/foundations/control-track/default/md/light/rest-1440",
    "storyId": "foundations-measurement-targets--target-lineup",
    "ownerBrief": "03",
    "executionMode": "automated",
    "selectors": {
      "root": {
        "attribute": "data-geometry-id",
        "value": "target-control-track-md",
        "kind": "element"
      }
    },
    "scenario": {
      "engine": "chromium",
      "viewport": {
        "width": 1440,
        "height": 900
      },
      "colorScheme": "light",
      "direction": "ltr",
      "pointer": "fine",
      "forcedColors": "none",
      "reducedMotion": "no-preference",
      "initialState": "rest",
      "actions": [],
      "assertions": [
        {
          "op": "box",
          "target": "root",
          "metric": "height",
          "expected": 32,
          "tolerance": 0.5,
          "unit": "css-px"
        },
        {
          "op": "style",
          "target": "root",
          "property": "height",
          "expected": "32px"
        },
        {
          "op": "attribute",
          "target": "root",
          "name": "data-state",
          "expected": null
        },
        {
          "op": "screenshot",
          "target": "root"
        }
      ]
    },
    "transfer": null
  },
  {
    "schemaVersion": 1,
    "caseId": "geometry/foundations/control-track/default/md/light/rest-320",
    "storyId": "foundations-measurement-targets--target-lineup",
    "ownerBrief": "03",
    "executionMode": "automated",
    "selectors": {
      "root": {
        "attribute": "data-geometry-id",
        "value": "target-control-track-md",
        "kind": "element"
      }
    },
    "scenario": {
      "engine": "chromium",
      "viewport": {
        "width": 320,
        "height": 800
      },
      "colorScheme": "light",
      "direction": "ltr",
      "pointer": "fine",
      "forcedColors": "none",
      "reducedMotion": "no-preference",
      "initialState": "rest",
      "actions": [],
      "assertions": [
        {
          "op": "box",
          "target": "root",
          "metric": "height",
          "expected": 32,
          "tolerance": 0.5,
          "unit": "css-px"
        },
        {
          "op": "style",
          "target": "root",
          "property": "height",
          "expected": "32px"
        },
        {
          "op": "attribute",
          "target": "root",
          "name": "data-state",
          "expected": null
        },
        {
          "op": "screenshot",
          "target": "root"
        }
      ]
    },
    "transfer": null
  },
  {
    "schemaVersion": 1,
    "caseId": "geometry/foundations/control-track/default/md/light/rest-390",
    "storyId": "foundations-measurement-targets--target-lineup",
    "ownerBrief": "03",
    "executionMode": "automated",
    "selectors": {
      "root": {
        "attribute": "data-geometry-id",
        "value": "target-control-track-md",
        "kind": "element"
      }
    },
    "scenario": {
      "engine": "chromium",
      "viewport": {
        "width": 390,
        "height": 844
      },
      "colorScheme": "light",
      "direction": "ltr",
      "pointer": "fine",
      "forcedColors": "none",
      "reducedMotion": "no-preference",
      "initialState": "rest",
      "actions": [],
      "assertions": [
        {
          "op": "box",
          "target": "root",
          "metric": "height",
          "expected": 32,
          "tolerance": 0.5,
          "unit": "css-px"
        },
        {
          "op": "style",
          "target": "root",
          "property": "height",
          "expected": "32px"
        },
        {
          "op": "attribute",
          "target": "root",
          "name": "data-state",
          "expected": null
        },
        {
          "op": "screenshot",
          "target": "root"
        }
      ]
    },
    "transfer": null
  },
  {
    "schemaVersion": 1,
    "caseId": "geometry/foundations/control-track/default/micro/dark/rest-1440",
    "storyId": "foundations-measurement-targets--target-lineup",
    "ownerBrief": "03",
    "executionMode": "automated",
    "selectors": {
      "root": {
        "attribute": "data-geometry-id",
        "value": "target-control-track-micro",
        "kind": "element"
      }
    },
    "scenario": {
      "engine": "chromium",
      "viewport": {
        "width": 1440,
        "height": 900
      },
      "colorScheme": "dark",
      "direction": "ltr",
      "pointer": "fine",
      "forcedColors": "none",
      "reducedMotion": "no-preference",
      "initialState": "rest",
      "actions": [],
      "assertions": [
        {
          "op": "box",
          "target": "root",
          "metric": "height",
          "expected": 24,
          "tolerance": 0.5,
          "unit": "css-px"
        },
        {
          "op": "style",
          "target": "root",
          "property": "height",
          "expected": "24px"
        },
        {
          "op": "attribute",
          "target": "root",
          "name": "data-state",
          "expected": null
        },
        {
          "op": "screenshot",
          "target": "root"
        }
      ]
    },
    "transfer": null
  },
  {
    "schemaVersion": 1,
    "caseId": "geometry/foundations/control-track/default/micro/light/rest-1440",
    "storyId": "foundations-measurement-targets--target-lineup",
    "ownerBrief": "03",
    "executionMode": "automated",
    "selectors": {
      "root": {
        "attribute": "data-geometry-id",
        "value": "target-control-track-micro",
        "kind": "element"
      }
    },
    "scenario": {
      "engine": "chromium",
      "viewport": {
        "width": 1440,
        "height": 900
      },
      "colorScheme": "light",
      "direction": "ltr",
      "pointer": "fine",
      "forcedColors": "none",
      "reducedMotion": "no-preference",
      "initialState": "rest",
      "actions": [],
      "assertions": [
        {
          "op": "box",
          "target": "root",
          "metric": "height",